{
 "$schema": "https://json-schema.org/draft/2020-12/schema",
 "$id": "https://example.com/it-assessment-bank/item.schema.json",
 "title": "Задание банка оценки IT-компетенций",
 "type": "object",
 "additionalProperties": false,
 "required": [
  "id",
  "specialization",
  "level",
  "type",
  "competency",
  "difficulty",
  "question",
  "options",
  "correct_answer",
  "score",
  "explanation",
  "tags",
  "version_group",
  "seedable",
  "seed_parameters",
  "validation_type"
 ],
 "properties": {
  "id": {
   "type": "string",
   "pattern": "^(FE|BE|QA)-(J|M|S)-(T|S|P)-[0-9]{3}$",
   "description": "Неизменяемый идентификатор. Префиксы должны совпадать с полями specialization, level, type."
  },
  "specialization": { "enum": ["frontend", "backend", "qa"] },
  "level": { "enum": ["junior", "middle", "senior"] },
  "type": { "enum": ["theory", "situational", "practical"] },
  "competency": {
   "type": "string",
   "description": "Значение из COMPETENCIES[specialization] (tools/blueprint.py)."
  },
  "difficulty": {
   "type": "integer",
   "minimum": 1,
   "maximum": 10,
   "description": "1-3 junior, 4-6 middle, 7-10 senior. Обязана соответствовать полю level."
  },
  "question": { "type": "string", "minLength": 10 },
  "language": {
   "type": "string",
   "description": "Язык фрагмента в поле code: javascript, typescript, python, sql, html, css, http, json, yaml, bash, text."
  },
  "code": {
   "type": "string",
   "description": "Фрагмент кода, данных или журнала. Строки нумеруются вручную, если вопрос ссылается на номер строки."
  },
  "options": {
   "type": "array",
   "description": "Для single_choice и multiple_choice — ровно 4 элемента с id A, B, C, D по порядку. Для остальных типов — пустой массив.",
   "items": {
    "type": "object",
    "additionalProperties": false,
    "required": ["id", "text"],
    "properties": {
     "id": { "enum": ["A", "B", "C", "D", "E", "F"] },
     "text": { "type": "string", "minLength": 1 }
    }
   }
  },
  "correct_answer": {
   "type": "array",
   "minItems": 1,
   "description": "Для вариантных типов — буквы вариантов. Для numeric, exact_match, code_output — эталонные значения в виде строк.",
   "items": { "type": "string" }
  },
  "answer_normalization": {
   "type": "array",
   "description": "Применяется к ответу кандидата и к эталону. По умолчанию [\"trim\"].",
   "items": {
    "enum": ["trim", "lowercase", "uppercase", "remove_spaces", "collapse_whitespace"]
   }
  },
  "score": {
   "type": "integer",
   "enum": [1, 2, 3, 4],
   "description": "Жёстко выводится из difficulty: 1-3 -> 1, 4-6 -> 2, 7-8 -> 3, 9-10 -> 4."
  },
  "explanation": {
   "type": "string",
   "minLength": 60,
   "description": "Почему ответ правильный и почему остальные варианты неверны. Показывается кандидату только после завершения попытки."
  },
  "tags": {
   "type": "array",
   "items": { "type": "string" },
   "description": "Свободные метки для поиска и отчётности. На алгоритмы не влияют."
  },
  "version_group": {
   "type": ["string", "null"],
   "description": "Семейство заданий, проверяющих одно и то же. Генератор берёт не более одного задания из группы в попытку. Разброс difficulty внутри группы — не более 2."
  },
  "seedable": {
   "type": "boolean",
   "description": "Разрешено ли варьировать задание по сиду (выбор варианта и перестановка ответов)."
  },
  "seed_parameters": {
   "type": "array",
   "description": "Чем различаются формы задания. option_order реализуется в рантайме; остальные параметры — заранее заготовленными элементами variants.",
   "items": {
    "enum": ["option_order", "input_values", "variable_names", "array_length"]
   }
  },
  "validation_type": {
   "enum": ["single_choice", "multiple_choice", "numeric", "exact_match", "code_output"],
   "description": "single_choice — один верный вариант. multiple_choice — несколько, зачёт по полному совпадению. numeric — число с точностью 1e-9. exact_match — строка после нормализации. code_output — то же, но эталон является ожидаемым выводом программы."
  },
  "variants": {
   "type": "array",
   "description": "Дополнительные формы задания. Базовая форма имеет variant_id v1 и описана полями самого задания. Все формы проверяют одну компетенцию и имеют одинаковую сложность.",
   "items": {
    "type": "object",
    "additionalProperties": false,
    "required": ["variant_id", "options", "correct_answer"],
    "properties": {
     "variant_id": { "type": "string", "pattern": "^v[0-9]+$" },
     "question": { "type": "string" },
     "language": { "type": "string" },
     "code": { "type": "string" },
     "options": {
      "type": "array",
      "items": {
       "type": "object",
       "additionalProperties": false,
       "required": ["id", "text"],
       "properties": {
        "id": { "enum": ["A", "B", "C", "D", "E", "F"] },
        "text": { "type": "string", "minLength": 1 }
       }
      }
     },
     "correct_answer": { "type": "array", "minItems": 1, "items": { "type": "string" } },
     "explanation": { "type": "string" }
    }
   }
  },
  "_source_file": {
   "type": "string",
   "description": "Служебное поле, добавляемое загрузчиком. В dist/bank.json отсутствует."
  }
 },
 "allOf": [
  {
   "if": { "properties": { "validation_type": { "enum": ["single_choice", "multiple_choice"] } } },
   "then": { "properties": { "options": { "minItems": 4, "maxItems": 4 } } }
  },
  {
   "if": { "properties": { "validation_type": { "enum": ["numeric", "exact_match", "code_output"] } } },
   "then": { "properties": { "options": { "maxItems": 0 } } }
  },
  {
   "if": { "properties": { "validation_type": { "const": "single_choice" } } },
   "then": { "properties": { "correct_answer": { "minItems": 1, "maxItems": 1 } } }
  },
  {
   "if": { "properties": { "validation_type": { "const": "multiple_choice" } } },
   "then": { "properties": { "correct_answer": { "minItems": 2, "maxItems": 3 } } }
  }
 ]
}
