[
 {
  "id": "FE-S-P-001",
  "specialization": "frontend",
  "level": "senior",
  "type": "practical",
  "competency": "javascript",
  "difficulty": 8,
  "question": "Что выведет код? Введите метки в порядке вывода через запятую без пробелов.",
  "language": "javascript",
  "code": "console.log('A');\nsetTimeout(() => console.log('B'), 0);\nPromise.resolve().then(() => console.log('C'));\nqueueMicrotask(() => console.log('D'));\nconsole.log('E');",
  "options": [],
  "correct_answer": [
   "A,E,C,D,B"
  ],
  "score": 3,
  "explanation": "Синхронный код выполняется первым: A и E. Затем опустошается очередь микрозадач в порядке постановки: C (then) и D (queueMicrotask). Макрозадача таймера B выполняется последней, несмотря на нулевую задержку.",
  "tags": [
   "javascript",
   "event-loop",
   "code_output"
  ],
  "version_group": "FE-SP-EVENTLOOP-ORDER",
  "seedable": true,
  "seed_parameters": [
   "input_values"
  ],
  "validation_type": "exact_match",
  "answer_normalization": [
   "trim",
   "uppercase",
   "remove_spaces"
  ],
  "variants": [
   {
    "variant_id": "v2",
    "code": "setTimeout(() => console.log('T'), 0);\n(async () => {\n  console.log('S');\n  await null;\n  console.log('M');\n})();\nconsole.log('L');",
    "options": [],
    "correct_answer": [
     "S,L,M,T"
    ],
    "explanation": "Синхронно выполняются S (тело асинхронной функции до первого await) и L. После await продолжение M попадает в очередь микрозадач и выполняется раньше таймера T."
   },
   {
    "variant_id": "v3",
    "code": "console.log('1');\nPromise.resolve().then(() => {\n  console.log('2');\n  setTimeout(() => console.log('3'), 0);\n});\nsetTimeout(() => console.log('4'), 0);\nconsole.log('5');",
    "options": [],
    "correct_answer": [
     "1,5,2,4,3"
    ],
    "explanation": "Синхронно выводятся 1 и 5. Затем микрозадача печатает 2 и ставит таймер 3 в очередь после уже запланированного таймера 4, поэтому порядок: 1, 5, 2, 4, 3."
   }
  ]
 },
 {
  "id": "FE-S-P-002",
  "specialization": "frontend",
  "level": "senior",
  "type": "practical",
  "competency": "javascript",
  "difficulty": 7,
  "question": "Профилирование памяти показывает, что экземпляры ChartWidget не освобождаются после закрытия экрана. Какая строка создаёт утечку?",
  "language": "javascript",
  "code": "1  class ChartWidget {\n2    constructor(node) {\n3      this.node = node;\n4      this.onResize = this.onResize.bind(this);\n5      window.addEventListener('resize', this.onResize);\n6      this.observer = new ResizeObserver(this.onResize);\n7      this.observer.observe(node);\n8    }\n9    destroy() {\n10     this.observer.disconnect();\n11     this.node = null;\n12   }\n13 }",
  "options": [
   {
    "id": "A",
    "text": "Строка 4: привязка метода через bind создаёт новую функцию при каждом создании экземпляра"
   },
   {
    "id": "B",
    "text": "Строка 5: обработчик добавлен на window, но в destroy он не снимается, поэтому window держит ссылку на экземпляр"
   },
   {
    "id": "C",
    "text": "Строка 11: присваивание null не освобождает DOM-узел"
   },
   {
    "id": "D",
    "text": "Строка 6: ResizeObserver нельзя создавать с привязанным методом"
   }
  ],
  "correct_answer": [
   "B"
  ],
  "score": 3,
  "explanation": "window живёт всё время работы страницы, и зарегистрированный на нём обработчик держит сильную ссылку на экземпляр вместе со всем, что тот захватил. Каждая регистрация должна иметь парное снятие в destroy. Отключение ResizeObserver сделано правильно, bind сам по себе утечки не создаёт.",
  "tags": [
   "javascript",
   "memory-leak",
   "bug-finding"
  ],
  "version_group": "FE-SP-LISTENER-LEAK",
  "seedable": true,
  "seed_parameters": [
   "option_order",
   "variable_names"
  ],
  "validation_type": "single_choice",
  "variants": [
   {
    "variant_id": "v2",
    "code": "1  function mountPoller(store) {\n2    const id = setInterval(() => store.refresh(), 5000);\n3    const onVisible = () => store.refresh();\n4    document.addEventListener('visibilitychange', onVisible);\n5    return () => {\n6      document.removeEventListener('visibilitychange', onVisible);\n7    };\n8  }",
    "options": [
     {
      "id": "A",
      "text": "Строка 3: обработчик нужно объявить как метод стора"
     },
     {
      "id": "B",
      "text": "Строка 4: вместо document следует использовать window, иначе обработчик не снимается при закрытии"
     },
     {
      "id": "C",
      "text": "Строка 2: интервал в 5000 мс слишком частый"
     },
     {
      "id": "D",
      "text": "Строка 5: очистка не снимает интервал, и опрос со ссылкой на store живёт дальше"
     }
    ],
    "correct_answer": [
     "D"
    ],
    "question": "Профилирование показывает, что после размонтирования виджета продолжаются запросы обновления, а store не освобождается. Какая строка создаёт утечку?",
    "explanation": "Функция очистки снимает обработчик события, но не останавливает интервал: таймер продолжает вызывать store.refresh и удерживает ссылку на store. В очистке нужен clearInterval(id)."
   }
  ]
 },
 {
  "id": "FE-S-P-003",
  "specialization": "frontend",
  "level": "senior",
  "type": "practical",
  "competency": "javascript",
  "difficulty": 9,
  "question": "Функция должна выполнять задачи с ограничением параллелизма, но фактически запускает все задачи сразу. В какой строке ошибка?",
  "language": "javascript",
  "code": "1  async function runLimited(tasks, limit) {\n2    const results = [];\n3    const running = [];\n4    for (const task of tasks) {\n5      const p = task();\n6      results.push(p);\n7      running.push(p);\n8      if (running.length >= limit) {\n9        running.splice(0, running.length);\n10     }\n11   }\n12   return Promise.all(results);\n13 }",
  "options": [
   {
    "id": "A",
    "text": "Строка 6: промисы нельзя складывать в массив результатов"
   },
   {
    "id": "B",
    "text": "Строка 5: задачу нужно вызывать через await task()"
   },
   {
    "id": "C",
    "text": "Строка 12: вместо Promise.all нужен Promise.allSettled, чтобы дождаться всех задач"
   },
   {
    "id": "D",
    "text": "Строка 9: список очищается без ожидания — нужно дождаться слота через await Promise.race(running)"
   }
  ],
  "correct_answer": [
   "D"
  ],
  "score": 4,
  "explanation": "Ограничение параллелизма требует ожидания: при заполнении окна нужно дождаться завершения любого из выполняющихся промисов и убрать из списка именно его. Очистка массива без ожидания никак не сдерживает запуск. Вариант с await task() сделал бы выполнение строго последовательным, то есть параллелизм равным единице.",
  "tags": [
   "javascript",
   "concurrency",
   "bug-finding"
  ],
  "version_group": "FE-SP-CONCURRENCY-LIMIT",
  "seedable": true,
  "seed_parameters": [
   "option_order",
   "variable_names",
   "input_values"
  ],
  "validation_type": "single_choice",
  "variants": []
 },
 {
  "id": "FE-S-P-004",
  "specialization": "frontend",
  "level": "senior",
  "type": "practical",
  "competency": "javascript",
  "difficulty": 8,
  "question": "Ошибка внутри setTimeout не попадает в блок catch, и приложение падает. Почему и как это исправить?",
  "language": "javascript",
  "code": "try {\n  setTimeout(() => {\n    throw new Error('fail');\n  }, 100);\n} catch (e) {\n  report(e);\n}",
  "options": [
   {
    "id": "A",
    "text": "Колбэк выполняется позже, когда try уже завершён: ловить ошибку нужно внутри колбэка"
   },
   {
    "id": "B",
    "text": "Нужно заменить setTimeout на queueMicrotask, тогда исключение попадёт в блок catch вокруг вызова"
   },
   {
    "id": "C",
    "text": "Нужно сделать колбэк асинхронным и добавить await перед throw, чтобы внешний catch его увидел"
   },
   {
    "id": "D",
    "text": "Нужно обернуть вызов setTimeout в Promise.resolve()"
   }
  ],
  "correct_answer": [
   "A"
  ],
  "score": 3,
  "explanation": "try/catch охватывает только синхронное выполнение своего блока. К моменту срабатывания таймера стек уже раскручен, и исключение уходит в глобальный обработчик. Нужен try/catch внутри колбэка или перевод операции в промис, отказ которого можно обработать. Микрозадача выполняется так же вне блока try.",
  "tags": [
   "javascript",
   "error-handling",
   "async"
  ],
  "version_group": "FE-SP-ASYNC-TRY",
  "seedable": true,
  "seed_parameters": [
   "option_order",
   "input_values"
  ],
  "validation_type": "single_choice",
  "variants": []
 },
 {
  "id": "FE-S-P-005",
  "specialization": "frontend",
  "level": "senior",
  "type": "practical",
  "competency": "react",
  "difficulty": 8,
  "question": "Эффект выполняется в бесконечном цикле. Какое исправление устраняет причину, сохраняя поведение?",
  "language": "javascript",
  "code": "function Report({ from, to }) {\n  const [data, setData] = useState(null);\n  const params = { from, to, tz: 'Europe/Moscow' };\n\n  useEffect(() => {\n    load(params).then(setData);\n  }, [params]);\n\n  return <Chart data={data} />;\n}",
  "options": [
   {
    "id": "A",
    "text": "Перенести создание params в useRef и читать .current"
   },
   {
    "id": "B",
    "text": "Убрать params из зависимостей и оставить пустой массив, чтобы эффект шёл один раз"
   },
   {
    "id": "C",
    "text": "Сравнивать params через JSON.stringify прямо в массиве зависимостей эффекта"
   },
   {
    "id": "D",
    "text": "Зависеть от примитивов from и to, а объект собирать внутри эффекта"
   }
  ],
  "correct_answer": [
   "D"
  ],
  "score": 3,
  "explanation": "Объект params создаётся заново при каждом рендере, его ссылка всегда новая, и эффект перезапускается после каждой записи данных. Зависимости должны состоять из примитивов, от которых реально зависит запрос. Сравнение через строку работает, но прячет зависимости от линтера и дорожает на больших объектах; пустой массив сломает обновление при смене периода, а ref не отслеживает изменения.",
  "tags": [
   "react",
   "useEffect",
   "dependencies",
   "bug-fixing"
  ],
  "version_group": "FE-SP-EFFECT-DEPS",